{
  "$schema": "https://json-schema.org/draft/2020-12/schema",
  "$id": "https://raw.githubusercontent.com/stack-sh/cli/main/distribution/distribution-contract-v3.schema.json",
  "title": "Stack CLI distribution contract",
  "type": "object",
  "additionalProperties": false,
  "required": [
    "schemaVersion",
    "product",
    "availability",
    "versioning",
    "artifacts",
    "targets",
    "unsupported",
    "channels",
    "verification"
  ],
  "properties": {
    "$schema": {
      "type": "string"
    },
    "schemaVersion": {
      "const": 3
    },
    "product": {
      "type": "object",
      "additionalProperties": false,
      "required": [
        "binary",
        "sourceCargoPackage",
        "publishedCargoPackage",
        "sourceVersionFile",
        "currentSourceVersion",
        "minimumRustVersion",
        "currentReleaseVersion"
      ],
      "properties": {
        "binary": {
          "const": "stack"
        },
        "sourceCargoPackage": {
          "const": "stack-diagram-cli"
        },
        "publishedCargoPackage": {
          "enum": [null, "stack-diagram-cli"]
        },
        "sourceVersionFile": {
          "const": "Cargo.toml"
        },
        "currentSourceVersion": {
          "$ref": "#/$defs/version"
        },
        "minimumRustVersion": {
          "type": "string",
          "pattern": "^[0-9]+\\.[0-9]+$"
        },
        "currentReleaseVersion": {
          "$ref": "#/$defs/version"
        }
      }
    },
    "availability": {
      "type": "object",
      "additionalProperties": false,
      "required": [
        "state",
        "message"
      ],
      "properties": {
        "state": {
          "enum": [
            "planned",
            "available"
          ]
        },
        "message": {
          "type": "string",
          "minLength": 1
        }
      }
    },
    "versioning": {
      "type": "object",
      "additionalProperties": false,
      "required": [
        "scheme",
        "tagTemplate",
        "stableVersionRequirement",
        "prereleaseVersionRequirement",
        "prereleasePolicy",
        "minimumSupportedVersionSource",
        "preOneSupportWindow",
        "stableSupportWindow"
      ],
      "properties": {
        "scheme": {
          "const": "Semantic Versioning"
        },
        "tagTemplate": {
          "const": "v{version}"
        },
        "stableVersionRequirement": {
          "type": "string",
          "minLength": 1
        },
        "prereleaseVersionRequirement": {
          "type": "string",
          "minLength": 1
        },
        "prereleasePolicy": {
          "type": "string",
          "minLength": 1
        },
        "minimumSupportedVersionSource": {
          "type": "string",
          "minLength": 1
        },
        "preOneSupportWindow": {
          "type": "string",
          "minLength": 1
        },
        "stableSupportWindow": {
          "type": "string",
          "minLength": 1
        }
      }
    },
    "artifacts": {
      "type": "object",
      "additionalProperties": false,
      "required": [
        "archiveNameTemplate",
        "archiveRootTemplate",
        "requiredEntries",
        "completionPaths",
        "manpagePath",
        "releaseManifestNameTemplate",
        "checksumNameTemplate",
        "signatureBundleNameTemplate",
        "sbomNameTemplate",
        "provenanceNameTemplate",
        "sbomAttestationNameTemplate",
        "checksumAlgorithm",
        "reproducibility"
      ],
      "properties": {
        "archiveNameTemplate": {
          "$ref": "#/$defs/template"
        },
        "archiveRootTemplate": {
          "$ref": "#/$defs/template"
        },
        "requiredEntries": {
          "type": "array",
          "minItems": 8,
          "uniqueItems": true,
          "items": {
            "type": "string",
            "minLength": 1
          }
        },
        "completionPaths": {
          "type": "object",
          "additionalProperties": false,
          "required": [
            "bash",
            "zsh",
            "fish"
          ],
          "properties": {
            "bash": {
              "const": "share/bash-completion/completions/stack"
            },
            "zsh": {
              "const": "share/zsh/site-functions/_stack"
            },
            "fish": {
              "const": "share/fish/vendor_completions.d/stack.fish"
            }
          }
        },
        "manpagePath": {
          "const": "share/man/man1/stack.1"
        },
        "releaseManifestNameTemplate": {
          "$ref": "#/$defs/template"
        },
        "checksumNameTemplate": {
          "$ref": "#/$defs/template"
        },
        "signatureBundleNameTemplate": {
          "$ref": "#/$defs/template"
        },
        "sbomNameTemplate": {
          "$ref": "#/$defs/template"
        },
        "provenanceNameTemplate": {
          "$ref": "#/$defs/template"
        },
        "sbomAttestationNameTemplate": {
          "$ref": "#/$defs/template"
        },
        "checksumAlgorithm": {
          "const": "sha256"
        },
        "reproducibility": {
          "type": "object",
          "additionalProperties": false,
          "required": [
            "archiveOrder",
            "uid",
            "gid",
            "mtime",
            "gzipHeader"
          ],
          "properties": {
            "archiveOrder": {
              "type": "string",
              "minLength": 1
            },
            "uid": {
              "const": 0
            },
            "gid": {
              "const": 0
            },
            "mtime": {
              "const": "SOURCE_DATE_EPOCH"
            },
            "gzipHeader": {
              "type": "string",
              "minLength": 1
            }
          }
        }
      }
    },
    "targets": {
      "type": "array",
      "minItems": 1,
      "items": {
        "$ref": "#/$defs/target"
      }
    },
    "unsupported": {
      "type": "array",
      "items": {
        "type": "object",
        "additionalProperties": false,
        "required": [
          "platform",
          "reason"
        ],
        "properties": {
          "platform": {
            "type": "string",
            "minLength": 1
          },
          "reason": {
            "type": "string",
            "minLength": 1
          }
        }
      }
    },
    "channels": {
      "type": "array",
      "minItems": 1,
      "items": {
        "$ref": "#/$defs/channel"
      }
    },
    "verification": {
      "type": "object",
      "additionalProperties": false,
      "required": [
        "releaseActivation",
        "rollback"
      ],
      "properties": {
        "releaseActivation": {
          "type": "array",
          "minItems": 1,
          "uniqueItems": true,
          "items": {
            "type": "string",
            "minLength": 1
          }
        },
        "rollback": {
          "type": "string",
          "minLength": 1
        }
      }
    }
  },
  "$defs": {
    "version": {
      "type": "string",
      "pattern": "^[0-9]+\\.[0-9]+\\.[0-9]+(?:-rc\\.[1-9][0-9]*)?$"
    },
    "template": {
      "type": "string",
      "pattern": "\\{version\\}"
    },
    "target": {
      "type": "object",
      "additionalProperties": false,
      "required": [
        "target",
        "os",
        "architecture",
        "libc",
        "minimumRuntime",
        "supportTier",
        "state"
      ],
      "properties": {
        "target": {
          "type": "string",
          "minLength": 1
        },
        "os": {
          "enum": [
            "macos",
            "linux"
          ]
        },
        "architecture": {
          "enum": [
            "arm64",
            "x86_64"
          ]
        },
        "libc": {
          "enum": [
            "system",
            "glibc"
          ]
        },
        "minimumRuntime": {
          "type": "string",
          "minLength": 1
        },
        "supportTier": {
          "const": "tier-1"
        },
        "state": {
          "enum": [
            "planned",
            "available"
          ]
        }
      }
    },
    "channel": {
      "type": "object",
      "additionalProperties": false,
      "required": [
        "id",
        "state",
        "targets",
        "owns",
        "source",
        "updatePolicy"
      ],
      "properties": {
        "id": {
          "enum": [
            "github-release",
            "homebrew",
            "cargo",
            "aqua"
          ]
        },
        "state": {
          "enum": [
            "planned",
            "available"
          ]
        },
        "targets": {
          "type": "array",
          "minItems": 1,
          "items": {
            "type": "string"
          }
        },
        "owns": {
          "type": "string",
          "minLength": 1
        },
        "source": {
          "type": "string",
          "minLength": 1
        },
        "updatePolicy": {
          "type": "string",
          "minLength": 1
        }
      }
    }
  }
}
