{
  "$schema": "./distribution-contract-v3.schema.json",
  "schemaVersion": 3,
  "product": {
    "binary": "stack",
    "sourceCargoPackage": "stack-diagram-cli",
    "publishedCargoPackage": "stack-diagram-cli",
    "sourceVersionFile": "Cargo.toml",
    "currentSourceVersion": "0.5.3",
    "minimumRustVersion": "1.85",
    "currentReleaseVersion": "0.5.3"
  },
  "availability": {
    "state": "available",
    "message": "Stack CLI 0.5.3 is available through GitHub Releases, Homebrew, Aqua, and Cargo. Cargo installs the stack-diagram-cli source package using Rust 1.85 or newer and registry-only dependencies."
  },
  "versioning": {
    "scheme": "Semantic Versioning",
    "tagTemplate": "v{version}",
    "stableVersionRequirement": "MAJOR.MINOR.PATCH without a prerelease suffix",
    "prereleaseVersionRequirement": "MAJOR.MINOR.PATCH-rc.N",
    "prereleasePolicy": "GitHub prerelease only; never selected by default by package managers",
    "minimumSupportedVersionSource": "Legacy release-manifest minimumSupportedCliVersion is set to the release version for schema compatibility; it does not authorize self-update",
    "preOneSupportWindow": "latest stable release only",
    "stableSupportWindow": "latest two minor lines after 1.0.0"
  },
  "artifacts": {
    "archiveNameTemplate": "stack-v{version}-{target}.tar.gz",
    "archiveRootTemplate": "stack-v{version}-{target}",
    "requiredEntries": [
      "stack",
      "LICENSE",
      "NOTICE",
      "THIRD_PARTY_LICENSES.md",
      "share/bash-completion/completions/stack",
      "share/zsh/site-functions/_stack",
      "share/fish/vendor_completions.d/stack.fish",
      "share/man/man1/stack.1"
    ],
    "completionPaths": {
      "bash": "share/bash-completion/completions/stack",
      "zsh": "share/zsh/site-functions/_stack",
      "fish": "share/fish/vendor_completions.d/stack.fish"
    },
    "manpagePath": "share/man/man1/stack.1",
    "releaseManifestNameTemplate": "stack-v{version}-release-manifest.json",
    "checksumNameTemplate": "stack-v{version}-checksums.txt",
    "signatureBundleNameTemplate": "stack-v{version}-checksums.txt.sigstore.json",
    "sbomNameTemplate": "stack-v{version}-{target}.spdx.json",
    "provenanceNameTemplate": "stack-v{version}-{target}.provenance.sigstore.json",
    "sbomAttestationNameTemplate": "stack-v{version}-{target}.sbom.sigstore.json",
    "checksumAlgorithm": "sha256",
    "reproducibility": {
      "archiveOrder": "bytewise path order",
      "uid": 0,
      "gid": 0,
      "mtime": "SOURCE_DATE_EPOCH",
      "gzipHeader": "no original filename or wall-clock timestamp"
    }
  },
  "targets": [
    {
      "target": "aarch64-apple-darwin",
      "os": "macos",
      "architecture": "arm64",
      "libc": "system",
      "minimumRuntime": "macOS 13",
      "supportTier": "tier-1",
      "state": "available"
    },
    {
      "target": "x86_64-apple-darwin",
      "os": "macos",
      "architecture": "x86_64",
      "libc": "system",
      "minimumRuntime": "macOS 13",
      "supportTier": "tier-1",
      "state": "available"
    },
    {
      "target": "aarch64-unknown-linux-gnu",
      "os": "linux",
      "architecture": "arm64",
      "libc": "glibc",
      "minimumRuntime": "glibc 2.31",
      "supportTier": "tier-1",
      "state": "available"
    },
    {
      "target": "x86_64-unknown-linux-gnu",
      "os": "linux",
      "architecture": "x86_64",
      "libc": "glibc",
      "minimumRuntime": "glibc 2.31",
      "supportTier": "tier-1",
      "state": "available"
    }
  ],
  "unsupported": [
    {
      "platform": "Windows",
      "reason": "No release build or smoke-test lane is defined."
    },
    {
      "platform": "Linux with musl libc, including Alpine Linux",
      "reason": "No musl artifact or runtime smoke-test lane is defined."
    },
    {
      "platform": "BSD",
      "reason": "No release build or smoke-test lane is defined."
    },
    {
      "platform": "32-bit architectures",
      "reason": "Only arm64 and x86_64 artifacts are in the supported matrix."
    }
  ],
  "channels": [
    {
      "id": "github-release",
      "state": "available",
      "targets": [
        "aarch64-apple-darwin",
        "x86_64-apple-darwin",
        "aarch64-unknown-linux-gnu",
        "x86_64-unknown-linux-gnu"
      ],
      "owns": "canonical immutable binary archives with generated shell completions and manual page, release manifest, checksums, signature bundle, SBOMs, and provenance",
      "source": "tagged stack-sh/cli source",
      "updatePolicy": "Verify and manually install the desired immutable GitHub release; never overwrite a package-manager-owned binary"
    },
    {
      "id": "homebrew",
      "state": "available",
      "targets": [
        "aarch64-apple-darwin",
        "aarch64-unknown-linux-gnu",
        "x86_64-unknown-linux-gnu"
      ],
      "owns": "formula metadata, GitHub archive URL and SHA-256 mapping, completion and manual placement, install, upgrade, and uninstall lifecycle on current Homebrew tier-1 hosts",
      "source": "github-release",
      "updatePolicy": "Homebrew owns upgrades; stack never replaces its own executable"
    },
    {
      "id": "cargo",
      "state": "available",
      "targets": [
        "aarch64-apple-darwin",
        "x86_64-apple-darwin",
        "aarch64-unknown-linux-gnu",
        "x86_64-unknown-linux-gnu"
      ],
      "owns": "the stack-diagram-cli crates.io source package and registry-only locked dependency graph; installs the stack binary with Rust 1.85 or newer",
      "source": "crates.io",
      "updatePolicy": "Cargo owns upgrades; stack never replaces its own executable"
    },
    {
      "id": "aqua",
      "state": "available",
      "targets": [
        "aarch64-apple-darwin",
        "x86_64-apple-darwin",
        "aarch64-unknown-linux-gnu",
        "x86_64-unknown-linux-gnu"
      ],
      "owns": "owner registry metadata, immutable registry revision, version pinning, and SHA-256 lock mapped to canonical GitHub archives",
      "source": "github-release",
      "updatePolicy": "Aqua owns upgrades; stack never replaces its own executable"
    }
  ],
  "verification": {
    "releaseActivation": [
      "tag equals v plus the Cargo package version",
      "all tier-1 archives build from the tagged commit",
      "all archive contents and metadata names match this contract",
      "all checksums, Sigstore bundles, SBOMs, and provenance verify",
      "stack --version, help, init, check, and render pass on each target",
      "generated shell completion source matches the archived bash, zsh, and fish files",
      "generated manual page matches the archived stack.1 file",
      "the release manifest records minimumSupportedCliVersion and each verified channel"
    ],
    "rollback": "Never replace a tag or asset. Mark a broken release as withdrawn, remove it from default update resolution, restore package-manager metadata to the last verified release, and publish a new patch version."
  }
}
